Website Links,Category,Description,Keywords,Techstacks
https://insitechstaging.com/demo/greatwork-logistics/,Transportation & Logistics,"GreatWork Logistics is a company that offers a range of logistics solutions, including freight services, maritime logistics, and courier services. The website provides information about their services, industries they serve, and allows visitors to request a quote.","Logistics, Freight Services, Courier Services, Maritime Logistics, Shipping Agency","WordPress, Elementor"
https://insitechstaging.com/demo/weapon-retention/,Other (Security Training),"This website promotes a company specializing in weapon retention training and related security services. It offers courses, demonstrations, and information about their expertise in disarming techniques and safety.","Weapon Retention, Security Training, Disarming Techniques, Self-Defense, Law Enforcement Training","WordPress, Elementor"
https://insitechstaging.com/demo/westminsterparty,Event Planning,"The website appears to be for a party planning and event services company, specializing in elegant and stylish events. It showcases their services, portfolio, and provides contact information for inquiries and bookings.","Event Planning, Party Planning, Wedding Planning, Corporate Events, Westminster Events","WordPress, Elementor"
https://insitechstaging.com/demo/bromley-collision,Legal Services,"Bromley Collision Law is a law firm specializing in personal injury claims arising from car accidents and other incidents. They offer legal representation to individuals injured due to the negligence of others, helping them navigate the claims process and seek compensation for their damages.","InjuryLawyer, AutoInjury, AccidentalCoverage, Settlements, LegalConsultation","WordPress, Elementor"
https://insitechstaging.com/demo/charles-clark,Real Estate,"The website showcases Charles Clark's real estate services, focusing on luxury properties. It offers property listings, neighborhood insights, and tools like a mortgage calculator.","Real Estate, Luxury Homes, Property Listings, Mortgage Calculator, Charles Clark","WordPress, Elementor"
https://insitechstaging.com/demo/lucky-old/,Real Estate,This website appears to be a landing page for a real estate company specializing in property management and potentially buying and selling properties. The site focuses on showcasing properties and providing contact information.,"Property Management, Real Estate, Buy and Sell, Property Listings, Home Buying","WordPress, Elementor"
https://insitechstaging.com/demo/spectrum-group,Business Services,"The website appears to be for a business consultancy called Spectrum Group. It provides services related to business development, operational excellence, and technology transformation to help businesses achieve their strategic goals.","Business Consultancy, Business Solutions, Business Advisor, IT Consultant, Business Development","WordPress, Elementor"
https://insitechstaging.com/demo/sustainatech/,EnvironmentalIndustrial,"The SustainaTech website promotes sustainable industrial practices and environmental solutions, focusing on reducing carbon emissions and waste through innovative technologies and strategic partnerships. It aims to educate and connect businesses with sustainable resources and strategies for a greener future.","Sustainability, Environmental Solutions, Carbon Reduction, Waste Management, Green Technology","WordPress, Elementor"
https://insitechstaging.com/demo/jounrey/,Health & Wellness,"This website promotes a holistic approach to wellness, focusing on the interconnectedness of physical, mental, and emotional health through personalized coaching and programs. It aims to empower individuals to achieve their wellness goals.","health coaching, wellness journey, personalized wellness, holistic health, wellbeing","WordPress, Elementor"
https://insitechstaging.com/demo/price-refractory/,Manufacturing & Industrial,"This website showcases refractory products and solutions, primarily focusing on pricing and offering different types of refractory materials. It serves as a platform for users to explore and inquire about refractory products for industrial applications.","Refractory, Refractory materials, Industrial materials, High-temperature insulation, Price refractory","WordPress, Elementor"
https://insitechstaging.com/demo/zee-media/,Creative & Media,"This website appears to showcase the portfolio and capabilities of a creative agency or media production company specializing in visual content creation. It highlights services such as photography, videography, and potentially other media-related offerings.","photography, videography, creative agency, media production, visual content","WordPress, Elementor"
https://insitechstaging.com/demo/contour-cabinets/,Construction & Home Services,"The website showcases Contour Cabinets, a company specializing in designing, manufacturing, and installing custom cabinetry for kitchens and other spaces. It highlights their different cabinet styles, materials, and finishes, emphasizing the ability to create personalized solutions for customers.","Custom Cabinets, Kitchen Cabinets, Cabinet Design, Cabinet Installation, Cabinet Manufacturing","WordPress, Elementor"
https://insitechstaging.com/demo/limitless-equine,Pet Care,"Limitless Equine is a website dedicated to providing comprehensive care for horses, including boarding, training, and various equine services. It offers a range of specialized programs tailored to meet the individual needs of horses and their owners.","Horse boarding, Horse training, Equine care, Equine services, Horse health","WordPress, Elementor"
https://insitechstaging.com/demo/conte-stanley/,Real Estate,"The website appears to showcase Conte Stanley's real estate services, featuring property listings, agent information, and resources for buying and selling properties. It likely aims to attract potential clients looking to buy, sell, or rent properties.","Real Estate, Property Listings, Home Buying, Home Selling, Property Management","WordPress, Elementor"
https://insitechstaging.com/demo/gary-yancy/,Health & Wellness,"The website promotes Gary Yancy as a health and fitness professional, providing personal training and fitness coaching services. It highlights his experience, testimonials, and contact information for potential clients.","Personal Training, Fitness Coaching, Health, Wellness, Exercise","WordPress, Elementor"
https://insitechstaging.com/demo/circo-circus-funland/,Travel & Tourism,"The website promotes Circo Circus Funland, a vacation destination that appears to offer a variety of accommodations, attractions, and family-friendly activities, including a circus, hotels, and dining. It encourages visitors to book their stay and explore the different experiences available.","Circus, Funland, Vacation, Hotel, Entertainment, Family Activities","WordPress, Elementor"
https://insitechstaging.com/demo/brand-02,Digital Agency,"The website is a digital agency showcasing its services and expertise in digital marketing, web design, and development. It aims to attract potential clients by highlighting its portfolio, team, and client success stories.","Digital Marketing, Web Design, SEO, Digital Agency, Web Development","WordPress, Elementor"
https://insitechstaging.com/demo/wyatt-johnson/,Digital Agency,"The website appears to be a portfolio for a digital agency specializing in website design, development, and marketing, with a focus on showcasing their work and attracting new clients. It highlights their services, client testimonials, and provides contact information.","Website Design, Digital Marketing, Web Development, SEO, Portfolio","WordPress, Elementor"
https://insitechstaging.com/demo/james-veon/,Real Estate,"The website appears to be a landing page for James Veon, a real estate professional specializing in luxury properties. It highlights his expertise, featured listings, and provides contact information for potential clients.","Real Estate, Luxury Homes, Property, James Veon, Real Estate Agent","WordPress, Elementor"
https://insitechstaging.com/demo/cruise-landing/,Travel & Tourism,"This website promotes cruise vacations, showcasing destinations, deals, and onboard experiences. It encourages users to explore different cruise options and book their dream cruise.","Cruises, Cruise Vacations, Travel, Destinations, Cruise Deals","WordPress, Elementor"
https://portfolio.muhammadprojects.com/empowercareinsurance/,Financial Services,"EmpowerCare Insurance offers various insurance plans, including health, life, dental, and vision. The website provides information about different insurance products, allows users to get quotes, and facilitates policy purchases.","Insurance, Health Insurance, Life Insurance, Dental Insurance, Vision Insurance","WordPress, Elementor"
https://portfolio.muhammadprojects.com/give-back-solar/,Solar Energy,"This website promotes a ""Give Back Solar"" program, offering solar panel solutions with the goal of donating solar power to families in need for every system purchased. It also focuses on providing homeowners with affordable solar energy solutions while contributing to a social cause.","Solar panels, solar donation, renewable energy, solar installation, give back","WordPress, Elementor"
https://portfolio.muhammadprojects.com/da-drain-fellas/,Cleaning Services,"The website promotes ""DA Drain Fellas,"" a drain cleaning and plumbing service based in Toronto, specializing in drain cleaning, plumbing repairs, and emergency services. They offer services for residential, commercial, and industrial clients.","Drain cleaning, Plumbing, Toronto, Emergency plumbing, Sewer cleaning","WordPress, Elementor, HTML, CSS, JavaScript"
https://portfolio.muhammadprojects.com/great-plain/,Real Estate,"The website showcases Great Plain's real estate developments, focusing on modern home designs and community living. It features property listings, design concepts, and information about the company's vision.","Real Estate Development, Modern Homes, Community Living, Property Listing, Home Design","WordPress, Elementor"

https://bizcoconsultancy.com/,Business Services,"BizCo Consultancy is a professional services firm offering tailored business development solutions and advisories for start-ups, SMEs, and mid-size corporations, including company secretarial, financial reporting, and corporate tax services. They aim to be trusted business partners, helping clients grow and improve efficiency.","business development, business advisory, company secretarial, financial reporting, corporate tax, start-ups, SMEs, business consultancy, business solutions, Singapore","Apache, CSS, Elementor, HTML, HTML5, JavaScript, Jquery, PHP, WordPress, Wordpress, jQuery"
https://godavisfreight.com/,Transportation & Logistics: CourierServices,"This website offers specialized medical courier services for transporting specimens, pharmaceuticals, and medical documents with a focus on dependability, accuracy, and safety.","medical courier, specimen transport, pharmaceutical delivery, medical documents, dependable courier, safe transport, medical logistics","HTML, HTML5, JavaScript, Jquery, Nginx, WordPress, Wordpress, jQuery"
https://harkhunter.com/,E-commerce,An online store specializing in custom handmade fixed blade knives made from high carbon and tool steel. The website offers detailed listings of various hunting knives for purchase.,"custom knives, handmade knives, fixed blade, hunting knife, 1095 high carbon steel, D2 tool steel, full tang knife, knife sale, outdoor gear","Apache, HTML, HTML5, JavaScript, Jquery, WordPress, Wordpress, jQuery"
https://innovativesolutionsllc.com/,Construction & Home Services: HomeAutomation,"This website offers smart home and business automation solutions that provide energy savings and simplified control over lighting, climate, music, and security systems. It aims to enhance comfort, control, and ambiance through technology.","smart home, home automation, energy savings, lighting control, climate control, music control, security, home theater, technology, comfort, ambiance","Cloudflare, HTML, HTML5"
https://insitech.ae/,Digital Agency,"Insitech is a digital marketing agency based in Dubai specializing in SEO, SEM, social media, email marketing, and web design. They offer personalized digital marketing strategies and consulting services to help businesses increase visibility, traffic, and sales.","digital marketing, SEO, SEM, social media marketing, email marketing, web design, online marketing, Google Adwords, Google Analytics, content marketing, digital agency, Dubai","HTML, HTML5, LiteSpeed"
https://legacydevelopments.ky/,"Real Estate: RealEstateDevelopment(Construction, Financing, Operations, Management)","Legacy Developments Ltd. specializes in creating and delivering sustainable residential and commercial properties in the Cayman Islands, offering project management, development planning, and investment services to local and international clients.","real estate development, sustainable communities, residential properties, commercial properties, project management, property investment, Cayman Islands, market research, construction management, financial monitoring","Apache, CSS, Elementor, HTML, HTML5, JavaScript, Jquery, PHP, WordPress, Wordpress, jQuery"
https://munchiezmiamivending.com/,Retail & Specialty,"Munchiez Vending provides high-quality vending services offering a wide selection of drinks and snacks to businesses in Miami, Fort Lauderdale, and surrounding areas. They focus on customer preferences and provide reliable, locally owned vending solutions.","vending services, snacks, drinks, vending machines, customer service, Miami, Fort Lauderdale, local business, product selection","CSS, Elementor, HTML, HTML5, JavaScript, Jquery, Nginx, WordPress, Wordpress, jQuery"
https://mylres.com/,Real Estate: PropertyManagement,"This website offers comprehensive property management services in Orlando, including tenant screening, rent collection, maintenance coordination, and eviction handling. It aims to simplify rental management for property owners while ensuring tenant satisfaction and legal compliance.","property management, rental analysis, tenant screening, rent collection, maintenance requests, eviction services, landlord tenant law, Orlando real estate, rental property, online rent payment, property owner portal","Apache, HTML, HTML5, JavaScript, Jquery, PHP, WordPress, Wordpress, jQuery"
https://myprimarycleaning.com/,Cleaning Services,"Primary Cleaning Services is a licensed cleaning company serving Kansas City, offering reliable and eco-friendly residential, commercial, and facility cleaning services. They focus on thorough, safe, and affordable cleaning solutions to maintain healthy and sanitized environments for homes and businesses.","cleaning services, residential cleaning, commercial cleaning, facility cleaning, eco-friendly cleaning, deep cleaning, move-in cleaning, office cleaning, industrial cleaning, sanitizing, germ-free, OSHA-certified, Kansas City","Bootstrap, CSS, Elementor, HTML, HTML5, JavaScript, Jquery, Nginx, WordPress, Wordpress, jQuery"
https://ngentech.net/,Technology & IT,"This website offers IT services and support tailored to meet the technology needs of businesses, aiming to improve their operations and success.","IT services, technology support, business IT solutions, IT consulting, technology planning","Apache, Bootstrap, CSS, Elementor, HTML, HTML5, JavaScript, Jquery, PHP, WordPress, Wordpress, jQuery"
https://offerock.com/,Real Estate: BuyandSell,"This website offers a direct home buying service that eliminates commissions and fees, providing fast cash offers and handling repairs, cleaning, and moving costs to simplify the selling process.","direct home buyer, no commissions, no fees, fast cash offer, property purchase, home selling, repair handling, moving cost assistance, real estate, quick closing","Apache, HTML, HTML5, JavaScript, Jquery, PHP, WordPress, Wordpress, jQuery"
https://prestigepet-sitting.net/,Pet Care,"Prestige Pet-Sitting Agencies, LLC provides professional in-home pet-sitting services with a focus on personalized care and stellar customer service. Established in 2005, they employ background-checked sitters passionate about animal care and connected to local veterinary communities.","pet sitting, in-home pet care, pet sitters, animal care, professional pet services, background-checked sitters, veterinary, pet care, pet sitting agency, bonded and insured","HTML, HTML5, JavaScript, Jquery, Nginx, WordPress, Wordpress, jQuery"
https://sequoiatherapy.com/,Medical Services: MassageSpecialist,"This website provides information about the benefits of massage therapy as part of integrative medicine, highlighting its role in reducing stress, pain, and improving overall health. It emphasizes massage as a complementary treatment alongside standard medical care.","massage, integrative medicine, stress reduction, pain relief, muscle soreness, circulation, relaxation, immune function, anxiety, fibromyalgia, headaches, insomnia, back pain, sports injuries, medical care","HTML, HTML5, JavaScript, Nginx, PHP, Shopify, WordPress, Wordpress"
https://smallthingspetsitting.com/,Pet Care,Small Things Pet Sitting offers loving and reliable pet sitting services in Cherokee and North Fulton Counties. The website provides easy booking and a straightforward fee structure to care for pets while owners are away.,"pet sitting, pet care, pet services, pet sitter, Cherokee County, North Fulton County, animal care, pet boarding","CSS, Elementor, HTML, HTML5, Jquery, Nginx, WordPress, Wordpress, jQuery"
https://stvaonline.com/,Manufacturing & Industrial,"STVA specializes in manufacturing high-quality scaffolding and shoring solutions engineered to meet or exceed OSHA standards. With over 27 years of expertise and a state-of-the-art facility, they provide a wide range of products designed for safety, reliability, and efficiency in construction projects.","scaffolding, shoring, manufacturing, construction safety, OSHA standards, heavy-duty scaffolding, modular components, load tested, Houston manufacturing, construction equipment","CSS, Cloudflare, Elementor, HTML, HTML5, JavaScript, Jquery, WordPress, Wordpress, jQuery"
https://teachlearnlead.net/,Education & Learning,"Teach-Learn-Lead LLC is a comprehensive thought leadership platform offering curated resources for professional, personal, and spiritual development. It focuses on leadership, innovation, cultural understanding, and youth entrepreneurship through global partnerships, coaching, and collaboration.","professional development, personal development, leadership, innovation, cultural understanding, youth entrepreneurship, education resources, coaching, global partnerships, social impact","CSS, Elementor, HTML, HTML5, JavaScript, Jquery, Nginx, PHP, WooCommerce, WordPress, Wordpress, jQuery"
https://teampuggi.com/,Non-Profit & NGO,"This website serves as a platform for a non-profit organization, providing information about their mission, offering a shop for fundraising, resources to find help, and options to donate.","non-profit, charity, donate, fundraising, help, support, shop, community","HTML, HTML5, JavaScript, Jquery, Nginx, PHP, WordPress, Wordpress, jQuery"
https://tencowtees.com/,Creative & Media,"Ten Cow Tees is a family-owned business specializing in screen printing, embroidery, and promotional products, focusing on small to medium quantity orders with quick turnaround times. They serve the Layton, UT area and prioritize quality and customer service.","screen printing, embroidery, promotional products, small quantity orders, quick turnaround, custom printing, family-owned, Layton UT","HTML, HTML5, JavaScript, Jquery, Nginx, WordPress, Wordpress, jQuery"
https://tritonsoundresidential.com/,Real Estate: PropertyManagement,"Triton Sound Residential acquires, owns, and operates multifamily residential properties across the United States, focusing on Core Plus and Value-Add investment opportunities. They manage properties internally to provide quality and affordable housing with local market expertise.","multifamily properties, real estate investment, property management, Core Plus, Value-Add, residential housing, affordable housing, real estate portfolio, property operations, local expertise","CSS, Elementor, HTML, HTML5, JavaScript, Jquery, Nginx, WordPress, Wordpress, jQuery"
https://viridia.ky/,Real Estate,"VIRIDIA West is a sustainable community development adjacent to The Shores in Cayman, focusing on eco-friendly living and real estate opportunities.","VIRIDIA West, sustainable community, The Shores, Cayman, real estate, eco-friendly, community development","Apache, CSS, Elementor, HTML, HTML5, Jquery, PHP, WordPress, Wordpress, jQuery"
https://www.advancedxl.com/,Education & Learning,"The website offers an advanced Excel and Power BI training course designed for intermediate to advanced users aiming to become experts in data analysis and visualization. It is created by a recognized data science professional and author, providing practical and theoretical knowledge to enhance Excel skills.","Excel training, Power BI, data visualization, data analysis, advanced Excel, dashboards, data storytelling, Excel course, data science education","Apache, CSS, Elementor, HTML, HTML5, JavaScript, Jquery, WordPress, Wordpress, jQuery"
https://www.drmsusa.com/,Technology & IT,"DRMS provides premium custom software solutions and cybersecurity services for various sectors including government, education, finance, and medical facilities. They focus on protecting data and IT infrastructure while enhancing operational efficiency.","custom software solutions, cybersecurity, CJIS compliant, data protection, IT security, software development, government software, education software, financial institutions, medical facilities, technology consulting","Apache, CSS, Elementor, HTML, HTML5, JavaScript, Jquery, WordPress, Wordpress, jQuery"
https://zenergyhp.com/bossladyhealth/,Health & Wellness: Nutritionists,"This website offers a program focused on educating individuals about nutrition and exercise to promote healthier lifestyle choices. It aims to help users improve their health, increase energy, and maintain a balanced life through better eating habits and regular physical activity.","nutrition, healthy eating, exercise, lifestyle balance, diet, health improvement, energy, physical activity, healthy choices","HTML, HTML5, JavaScript, Jquery, LiteSpeed, PHP, WordPress, Wordpress, jQuery"
https://jegnite.com/,Technology & IT,"Jegnite Solutions, LLC provides IT and Engineering Management Services, leveraging industry best practices and certifications to deliver innovative solutions for government and private sector clients.","IT services, engineering management, project management, Agile, ITIL, IEEE standards, INCOSE, Scrum, government contracts, innovation, problem solving","HTML, HTML5"
https://freetenniscourts.com/,Sports & Recreation,FreeCourts is a platform that helps tennis enthusiasts in the Puget Sound area find free tennis courts. It aims to promote an active lifestyle and build a vibrant tennis community by making tennis accessible to players of all ages and skill levels.,"tennis courts, free tennis courts, tennis community, Puget Sound, active lifestyle, tennis players, sports recreation","Apache, HTML, HTML5, JavaScript, Jquery, PHP, WordPress, Wordpress, jQuery"
https://www.trianglesmartdivorce.com/,Legal Services: DivorceLawyer,"This website provides legal services specializing in divorce cases, offering guidance, mediation, and representation to help clients navigate the divorce process with minimal conflict and optimal outcomes.","divorce, divorce lawyer, mediation, child custody, alimony, property division, settlement, legal consultation, contested divorce, family law","Bootstrap, CSS, Elementor, HTML, HTML5, JavaScript, Jquery, Nginx, PHP, WordPress, Wordpress, jQuery"
https://hurghada.com/,Travel & Tourism,"This website provides information about Egypt as a holiday destination, highlighting popular activities such as snorkeling, diving, dining options, real estate rentals, and various tourist excursions including safaris and hot air balloon rides.","Egypt, holiday destination, snorkeling, diving, Red Sea, coral reefs, restaurants, steakhouse, fish restaurant, Italian cuisine, real estate, apartment rental, sea view apartment, hot air balloon, safari, Cairo tours, Pyramids of Giza, Great Sphinx, Egyptian Museum, tourism, travel","Bootstrap, HTML, HTML5, JavaScript, Jquery, LiteSpeed, WordPress, Wordpress, jQuery"
https://geraldinegarcia.net/,Fashion & Beauty,"Bridal Edit offers a Spring Bridal Collection featuring handmade garments crafted by skilled artisans in El Salvador. The brand focuses on producing high-quality, timeless bridal clothing in limited quantities using traditional methods.","bridal collection, handmade, El Salvador, high-quality materials, timeless fashion, limited quantities, artisanal garments, bridal wear","Bootstrap, Cloudflare, HTML, HTML5, JavaScript, Shopify"
https://teccolorcraft.com/,Creative & Media: CustomPrinting,"Tec Color Craft specializes in custom sticker and decal printing for businesses, offering high-quality screen and digital printing solutions to enhance brand awareness. With over 60 years of experience, they provide expert service from design to delivery for vibrant, durable stickers.","custom stickers, sticker printing, decal printing, screen printing, digital printing, brand awareness, custom packaging, printing technology, business branding, vibrant stickers","HTML, HTML5, JavaScript, Jquery, Squarespace, jQuery"
