Website Links,Category,Description,Keywords,Techstacks
https://insitechstaging.com/demo/AM-auto-body,Cleaning Services,"AM Auto Body is a car wash and auto detailing service provider, offering various cleaning packages and detailing options to enhance the appearance and protection of vehicles. The website allows users to learn about the services offered, view photos of completed work, and potentially request a quote or schedule an appointment.","Car Wash, Auto Detailing, Vehicle Cleaning, Car Polishing, Interior Detailing","HTML, CSS, JavaScript, WordPress (Likely based on the structure and common features)"
https://insitechstaging.com/demo/travel-agency,Travel & Tourism,"This website is for a travel agency, showcasing various travel packages and services. It allows users to browse destinations, view travel guides, and potentially book trips online.","Travel Agency, Tours, Vacations, Destinations, Online Booking","HTML, CSS, JavaScript, PHP, WordPress"
https://insitechstaging.com/demo/relocate-travel,Travel & Tourism,"The website promotes relocation travel services, offering assistance with finding and settling into new locations. It appears to focus on personalized experiences and potentially longer-term stays, contrasting with typical short vacations.","Relocation, Travel, Extended Stay, Accommodation, Destination Services, Moving Assistance",The website is built on WordPress.
https://insitechstaging.com/demo/twb-company/,Business Services,This website presents a company offering various business-related services. It seems to focus on providing tailored solutions and expertise to help businesses thrive.,"BusinessConsultancy, BusinessAdvisor, BusinessSolutions, ITConsultant, ProfessionalDevelopment","WordPress, HTML, CSS, JavaScript"
https://portfolio.muhammadprojects.com/civic-ai/,Technology & IT,This website showcases a portfolio of AI-powered civic engagement projects designed to improve community life and governance. It highlights projects that address various challenges by leveraging AI for better solutions.,"Civic AI, Artificial Intelligence, Community Solutions, AI Projects, Civic Engagement, Smart City","HTML, CSS, JavaScript, React (Likely based on the overall design and interactive elements)"
https://portfolio.muhammadprojects.com/yancyswingznthingz/,E-commerce,"Yancy Swingz N Thingz is an online store selling a variety of items including clothing, mugs, and accessories, often with a focus on humorous or relatable designs. The website appears to be aimed at a general audience looking for unique and potentially humorous gifts or personal items.","Clothing, Mugs, Accessories, Gifts, Online Store, Humor, Merchandise","HTML, CSS, JavaScript, WooCommerce, WordPress"
https://portfolio.muhammadprojects.com/legacy/,Digital Agency,This website serves as a digital portfolio showcasing the web development and design projects of Muhammad Projects. It highlights their skills and provides examples of their past work to attract potential clients.,"Web development, web design, portfolio, website design, digital agency","HTML, CSS, JavaScript, Bootstrap (likely)"
https://portfolio.muhammadprojects.com/tech-color,Digital Agency,"This website showcases the portfolio of Muhammad, a digital designer and developer. It highlights his expertise in web design and development, particularly focusing on visually appealing and modern layouts.","web design, web development, UI/UX, portfolio, responsive design","HTML, CSS, JavaScript, Bootstrap, Possibly a JavaScript framework/library (likely React or similar, judging by the project complexities)"
https://portfolio.muhammadprojects.com/intern/,Digital Agency,"The website serves as a portfolio showcasing Muhammad's skills and projects in digital marketing, SEO, and web development. It's designed to attract potential clients or employers by demonstrating his expertise and experience.","Digital Marketing, SEO, Web Development, Portfolio, Muhammad Projects","HTML, CSS, JavaScript (Likely with frameworks/libraries for styling and potentially React/Vue.js/Angular for interactivity), potentially a backend for portfolio management if needed."
https://portfolio.muhammadprojects.com/toons-ville/,Creative & Media,"Toons Ville is a portfolio website showcasing the animation, illustration, and design work of Muhammad Irfan. It presents a collection of visually appealing cartoon characters and projects, demonstrating the artist's creative abilities.","Animation, Illustration, Cartoon, Design, Portfolio, Muhammad Irfan","HTML, CSS, JavaScript"
https://portfolio.muhammadprojects.com/paramount/,Real Estate,"The website showcases Paramount Real Estate, likely a company focusing on luxury real estate listings and investment opportunities. The site emphasizes high-end properties, investor relations, and providing resources for clients seeking exclusive real estate services.","Luxury Real Estate, Real Estate Investments, Property Listings, High-End Properties, Investor Relations","HTML, CSS, JavaScript, PHP, WordPress (based on the file structure and elements observed)"
https://portfolio.muhammadprojects.com/free-tennis-courts/,Sports & Recreation,This website helps users find free public tennis courts near them. It provides a directory and map interface to locate available tennis courts and encourages users to contribute by adding more courts to the database.,"Tennis courts, free tennis, public tennis courts, tennis court finder, tennis locations","HTML, CSS, JavaScript, Leaflet (for the map), potentially a backend database (though this isn't readily apparent from the front-end). It's likely a custom-built website rather than a platform like WordPress or Shopify."
https://portfolio.muhammadprojects.com/fantopia/,Creative & Media,"Fantopia is a portfolio website showcasing the work of a creative professional, likely a designer or artist. The site features various projects with visual elements and interactive design, aiming to impress potential clients and employers with their skills and creativity.","Portfolio, Design, Creative, Art, Web Design","HTML, CSS, JavaScript"
https://portfolio.muhammadprojects.com/voyage-v2/,Digital Agency,"This website appears to be a portfolio for a digital marketing agency or freelancer. It showcases their services and projects, likely aiming to attract potential clients seeking assistance with their online presence.","Digital Marketing, SEO, Web Development, Graphic Design, Portfolio","HTML, CSS, JavaScript, React (Likely based on the project structure and modern design)"
https://portfolio.muhammadprojects.com/handyman/,Construction & Home Services,"This website promotes a handyman service, offering a range of repair, maintenance, and installation services for homes and businesses. It aims to connect customers with skilled professionals for their property upkeep needs.","Handyman, Home Repair, Maintenance, Installation, Property Services","HTML, CSS, JavaScript (Likely uses a website builder or framework, but based on the front end it is difficult to identify.)"
http://4metaenergy.com/,Solar Energy,"4Meta Energy provides solar energy solutions, including solar panels, energy audits, and installation services. They aim to help customers save money and reduce their carbon footprint through sustainable energy.","Solar Panels, Solar Solutions, Audit Energy, Solar Installation, Renewable Energy","WordPress, Elementor"
https://bizcoconsultancy.com/,Business Services,"Bizco Consultancy provides business consulting services, including strategic planning, operational improvements, and technology implementation. They aim to help businesses achieve growth and improve performance through tailored solutions.","Business Consultancy, Strategic Planning, Operational Improvement, Technology Implementation, Business Solutions","WordPress, Elementor"
https://harkhunter.com/,Career & Recruitment,HarkHunter is a platform designed to help job seekers discover companies and career paths through AI-powered insights and personalized recommendations. It also allows companies to showcase their culture and attract the right talent.,"career discovery, job search, AI-powered career platform, company insights, talent acquisition","React, Node.js, GraphQL"
https://innovativesolutionsllc.com/,Business Services,"Innovative Solutions LLC provides comprehensive business solutions, including IT consulting, technology, and financial services to help businesses optimize operations and achieve their strategic goals. They offer services such as IT consulting, cloud computing solutions, and business funding.","IT consulting, Business solutions, Financial services, Technology solutions, Business funding","WordPress, Elementor"
https://insitech.ae/,Technology & IT,"InsiTech provides IT solutions and services to businesses in the UAE. They specialize in cloud computing, data organization, AI Chatbots, and other tech services to optimize and innovate business operations.","IT solutions, cloud computing, data organization, AI Chatbot, tech services","WordPress, Elementor"
https://legacydevelopments.ky/,Real Estate,"Legacy Developments is a real estate development company based in the Cayman Islands, specializing in residential and commercial properties. The website showcases their projects, provides information about the company, and offers contact information for inquiries.","Real Estate, Cayman Islands, Property Development, Residential, Commercial",WordPress
https://munchiezmiamivending.com/,Retail & Specialty,"Munchiez Miami Vending provides vending machine services in Miami, offering snacks, drinks, and customized vending options for businesses and locations. They focus on providing reliable and convenient vending solutions tailored to specific customer needs.","vending machines, vending services, Miami, snacks, drinks, customized vending","WordPress, Elementor"
https://mylres.com/,Real Estate,"My LRES is a real estate company that appears to focus on managing and selling properties. It offers services to those looking to buy, sell, or invest in real estate.","Real Estate, Property Management, Buy and Sell, Investments","WordPress, Elementor"
https://prestigepet-sitting.net/,Pet Care,"Prestige Pet Sitting provides professional pet sitting and dog walking services in Philadelphia, PA. They offer personalized care for pets in the comfort of their own homes, ensuring their well-being and happiness while their owners are away.","Pet Sitting, Dog Walking, Pet Care, Philadelphia, In-Home Pet Care","WordPress, Elementor"
https://smallthingspetsitting.com/,Pet Care,"Small Things Pet Sitting provides professional pet sitting and dog walking services in Raleigh, NC. They offer personalized care for pets in the comfort of their own homes, ensuring their well-being and happiness while their owners are away.","Pet Sitting, Dog Walking, Pet Care, Raleigh NC, Animal Care","WordPress, Elementor"
https://stvaonline.com/,Education & Learning,"STVA Online is an online language education platform that focuses on bilingual language learning through interactive methods, personalized learning, and cultural immersion. They offer various language programs and educational resources to facilitate effective language acquisition.","language education, bilingual learning, online language courses, interactive language learning, cultural immersion","WordPress, LearnDash, Elementor"
https://www.drmsusa.com/,Medical Services,"DRMS USA provides comprehensive medical record solutions for healthcare providers, focusing on compliance, security, and advanced technology. Their services include transcription, storage, and data management, aiming to improve efficiency and patient care in medical practices.","Medical records, transcription, data management, HIPAA compliance, healthcare solutions","WordPress, Elementor"
https://zenergyhp.com/bossladyhealth/,Health & Wellness,"Boss Lady Health provides personalized health and wellness coaching for women, focusing on mindset, nutrition, and exercise to achieve sustainable results. The program aims to help women overcome limiting beliefs, improve their relationship with food, and build a healthier, more confident version of themselves.","women's health, health coaching, mindset, nutrition, fitness","WordPress, Elementor"
https://freetenniscourts.com/,Sports & Recreation,"FreeTennisCourts.com helps users find free public tennis courts near them. The website provides a directory of tennis courts, often including details like addresses, amenities, and user reviews.","tennis courts, free tennis, find courts, public tennis, tennis locations","WordPress, Google Maps API"
https://hurghada.com/,Travel & Tourism,"Hurghada.com is a travel and tourism website providing information and services for visiting Hurghada, Egypt. It offers details on tours, activities, hotels, and other travel-related resources for planning a trip to this Red Sea destination.","Hurghada, Egypt, Travel, Tourism, Tours, Hotels, Activities","WordPress, PHP"
https://geraldinegarcia.net/,Fashion & Beauty,"Geraldine Garcia's website showcases her work as a wardrobe stylist, makeup artist, and image consultant. The site features her portfolio, services, and a blog covering fashion and beauty topics.","wardrobe stylist, makeup artist, image consultant, personal styling, fashion blog","WordPress, Elementor"
https://teccolorcraft.com/,Creative & Media,"Tec Color Craft offers a variety of custom printing services including screen printing, embroidery, and direct-to-garment printing. They specialize in apparel customization for businesses, events, and personal projects, with a focus on quality and customer satisfaction.","Custom printing, Screen printing, Embroidery, Apparel customization, Direct-to-garment","WordPress, Elementor"
https://subject2.com/,Health & Wellness,"The website promotes a holistic approach to health and wellness, offering guidance and resources for improving mental, physical, and emotional well-being. It emphasizes the interconnectedness of these aspects for achieving overall life balance and fulfillment.","Health, wellness, mental health, self-care, holistic health","WordPress, Elementor"
https://amplifywash.com/,Cleaning Services,"Amplifywash.com offers mobile car detailing and washing services, bringing professional car care directly to customers' locations. They focus on convenience and quality, using eco-friendly products to enhance and protect vehicles.","Mobile Car Detailing, Car Wash, Auto Detailing, Car Cleaning, Mobile Detailing Service","WordPress, Elementor"
https://esporter.win/landing-page/#,Gaming,"The website promotes Esporter, an online gaming coaching platform that connects players with professional coaches to improve their skills in various games. It offers personalized coaching plans, progress tracking, and a community for gamers.","Online gaming coaching, esports coaching, gaming skills, professional gamers, online gaming platform","HTML, CSS, JavaScript"
https://blackcedarinvestments.com/,Financial Services,Black Cedar Investments is an investment company that specializes in helping clients achieve financial independence through carefully crafted investment strategies. They offer personalized financial planning and investment solutions tailored to individual needs and goals.,"Investment Company, Financial Planning, Investment Strategies, Wealth Management, Financial Independence","WordPress, Elementor"
https://thevalemagazine.com/,Creative & Media,"The Vale Magazine is an online publication showcasing art, photography, fashion, and culture from various contributors. It serves as a platform for creative expression and offers articles, interviews, and visual content related to artistic endeavors.","Art, Photography, Fashion, Culture, Magazine","WordPress, Elementor"
https://www.threefarmfinancial.com/,Financial Services,"Three Farm Financial is a company that provides financial and insurance solutions specifically tailored for farmers and agricultural businesses. They offer services such as farm financing, insurance, and risk management to help farmers manage their operations and achieve financial stability.","Farmer financing, farm insurance, agricultural loans, crop insurance, farm risk management","WordPress, Elementor"
https://www.clairmontcg.com/,Business Services,"Clairmont Consulting Group is a business consulting firm that specializes in strategic planning, operational improvements, and financial performance for community banks and credit unions. They offer expertise in areas like enterprise risk management, technology optimization, and regulatory compliance to help financial institutions thrive in a competitive market.","Business Consultancy, Financial Institutions, Credit Unions, Strategic Planning, Risk Management","WordPress, Elementor"
https://namg.us/,Non-Profit & NGO,"The NAMG website aims to support ministries working with individuals and families experiencing poverty, addiction, and crisis by providing resources, training, and collaboration opportunities. They focus on empowering local churches and organizations to effectively address these challenges.","ministry support, poverty alleviation, addiction recovery, crisis intervention, non-profit collaboration","WordPress, Elementor"
https://www.ochealthysmiles.com/landing-page-2/,Medical Services,"The website promotes OC Healthy Smiles, a dental practice providing a range of services including cosmetic dentistry, implants, and general dental care. It emphasizes patient comfort, advanced technology, and a focus on creating healthy, beautiful smiles.","Dentist, Cosmetic Dentistry, Dental Implants, Teeth Whitening, Dental Care","WordPress, Elementor"
https://muhammadprojects.com/rob-kaufman/,Business Services,"The website promotes Rob Kaufman as a business advisor and consultant, focusing on helping business owners overcome challenges, improve performance, and achieve financial independence. It offers insights, articles, and resources related to business growth and development.","Business Consulting, Business Advisor, Financial Freedom, Entrepreneurship, Business Growth","WordPress, Elementor"
https://www.muhammadprojects.com/torch/,Education & Learning,"The website provides educational resources and support for individuals with learning variances, specifically focusing on dyslexia, ADHD, and speech challenges. It offers information, tools, and guidance to help learners overcome these difficulties.","Dyslexia, ADHD, Speech therapy, Learning variances, Special education","WordPress, Elementor"
https://www.muhammadprojects.com/william-thomas/,Business Services,"This website promotes William Thomas, a business coach, speaker, and advisor specializing in helping entrepreneurs and business owners achieve financial freedom and build profitable ventures. The site highlights his coaching programs, resources, and expertise in areas like financial freedom, business strategy, and overcoming limiting beliefs.","Business Coaching, Financial Freedom, Entrepreneurship, Business Advisor, Business Growth","WordPress, Elementor"
https://www.muhammadprojects.com/florentine-jewelry/,E-commerce,"This website showcases and sells Florentine jewelry, highlighting its unique craftsmanship and beauty. It offers a variety of jewelry pieces, allowing customers to purchase online.","Florentine jewelry, Italian jewelry, handcrafted jewelry, artisan jewelry, online jewelry store","WordPress, WooCommerce"
https://www.muhammadprojects.com/myopia-control/,Medical Services,"This website focuses on providing information and resources about myopia (nearsightedness) control and management, particularly for children. It aims to educate parents and individuals about different methods to slow down the progression of myopia.","Myopia control, nearsightedness, pediatric ophthalmology, orthokeratology, atropine eye drops","WordPress, Elementor"
https://muhammadprojects.com/jack-rose/,Music Artists,"This website promotes Jack Rose, a musician specializing in rock, jazz, and blues music, showcasing his original songs and instrumental compositions. It includes music samples, videos, a blog for updates, and contact information for bookings and collaborations.","Jack Rose, musician, rock music, jazz music, blues music","WordPress, Elementor"
https://www.muhammadprojects.com/calico-music/,Creative & Media,"This website showcases the musical compositions and projects of Calico Music, providing access to their discography, videos, and other creative works. It serves as a portfolio and platform for fans to engage with the artist's music.","Calico Music, music, composer, artist, discography","WordPress, Elementor"
https://clients.muhammadprojects.com/insitechv1/,Business Services,"This website appears to be a general business consultancy, providing services to help businesses grow and succeed. It offers a range of solutions, including business strategy, marketing, and technology implementation.","Business Consultancy, Business Solutions, IT Consultant, Business Advisor, Digital Marketing","WordPress, Elementor"
https://muhammadprojects.com/beauty-salon/,Fashion & Beauty,"This website promotes a beauty salon, showcasing its services such as haircuts, coloring, styling, and other beauty treatments. It aims to attract potential clients by providing information about the salon's offerings and contact details.","Beauty Salon, Haircuts, Hair Coloring, Hair Styling, Beauty Treatments","WordPress, Elementor"
https://mybeautysite.com/,Fashion & Beauty,"My Beauty Site appears to be a website focused on beauty products and potentially services. It likely offers a range of cosmetics, skincare, and haircare items.","Beauty products, Skincare, Cosmetics, Haircare, Salon&SPA","WordPress, WooCommerce"
https://portfolio.muhammadprojects.com/INKY-BLACKNESS/,Creative & Media,"The website showcases a portfolio of creative projects, primarily focusing on 3D art, character design, and visual storytelling. It serves as a platform for the artist to display their skills and attract potential clients or collaborators.","3D art, character design, portfolio, creative projects, visual storytelling","HTML, CSS, JavaScript"
https://portfolio.muhammadprojects.com/apekshya/,Digital Agency,"The website is a portfolio site for Apekhsya, showcasing their digital marketing and SEO skills through various projects and case studies. It aims to attract potential clients seeking digital marketing services.","Digital Marketing, SEO, Web Design, Portfolio, Content Marketing","WordPress, Elementor"
https://portfolio.muhammadprojects.com/tima-journal,Creative & Media,"The website is a portfolio showcasing the editorial design and branding work for ""TIMA Journal,"" a publication focused on fashion ethics and sustainability. It highlights the design choices, branding elements, and overall visual identity created for the journal.","Editorial Design, Branding, Fashion Ethics, Sustainability, Journal Design","HTML, CSS, JavaScript"
https://muhammadprojects.com/BrushWolfClothing/,E-commerce,"BrushWolf Clothing is an online store selling apparel with nature-inspired designs, specifically focused on wolves and outdoor themes. They offer a range of clothing items like t-shirts, hoodies, and long sleeves with unique graphics.","Apparel, Clothing, Wolf, Nature, Graphic Design, Outdoor","WooCommerce, WordPress"
https://hanyanurcollections.com/,E-commerce,"Hanyanur Collections is an online store that offers a variety of modest and stylish women's clothing, including dresses, tops, bottoms, and abayas. They focus on providing high-quality, fashionable pieces for women who prefer modest attire.","modest fashion, women's clothing, abayas, dresses, Islamic clothing",Shopify
https://wilsoncommunityoutreach.org/,Non-Profit & NGO,"Wilson Community Outreach is a non-profit organization dedicated to providing resources, support, and empowerment to the Wilson, NC community, focusing on areas such as housing, food security, and youth development. They aim to create positive change and improve the lives of individuals and families in need through various programs and initiatives.","Community outreach, Wilson NC, Non-profit, Housing, Food security, Youth development","WordPress, Elementor"
https://chef-monkey.com/,Food & Hospitality,"Chef Monkey is a website that offers private chef services, allowing users to book a personal chef for in-home or vacation meal preparation. They specialize in providing customized menus and a unique dining experience.","private chef, personal chef, in-home dining, vacation chef, meal preparation","WordPress, Elementor"
https://insitechstaging.com/demo/atf-contracting/,Construction & Home Services,"ATF Contracting is a contracting company specializing in a wide array of construction and renovation services, including roofing, windows, doors, siding, and more. They offer services for both residential and commercial clients.","Contracting, Roofing, Windows, Siding, Renovations","WordPress, Elementor"
https://insitechstaging.com/demo/art-of-marbles,E-commerce,"The website is an online store selling a variety of marble art pieces, including sculptures, decorative items, and more. It provides a platform for customers to browse and purchase unique marble creations.","Marble art, sculptures, decorative items, online store, art pieces","WooCommerce, WordPress"
https://insitechstaging.com/demo/financial-literacy,Financial Services,"The website provides resources and tools for improving financial literacy, including articles, calculators, and educational materials. It aims to empower individuals to make informed financial decisions and achieve financial well-being.","Financial literacy, financial education, personal finance, budgeting, investing","WordPress, Elementor"
