Website Links,Category,Description,Keywords,Techstacks
https://abstract-ai.com/,Technology & IT,"Abstract AI offers AI-powered solutions to automate tasks and workflows, providing businesses with personalized and efficient AI tools tailored to their specific needs. The platform emphasizes user-friendly interfaces and seamless integration, empowering businesses to leverage the benefits of AI without requiring extensive technical expertise.","AI, automation, AI platform, no-code AI, workflow automation, artificial intelligence, custom AI solutions","React (Likely based on the UI and modern website design), JavaScript, HTML, CSS"
https://esporter.win/home-2/,Gaming,"Esporter.win is a platform dedicated to connecting gamers with expert coaches to improve their gaming skills. It offers personalized coaching for popular esports titles, aiming to elevate players' performance and strategy.","esports coaching, gaming coaching, online gaming, gaming skills, esports training","WordPress, Elementor, JavaScript, CSS"
https://godavisfreight.com/,Transportation & Logistics,"Godavis Freight is a logistics company providing freight services, including transportation, warehousing, and supply chain solutions. They aim to deliver reliable and efficient logistical support to businesses.","Freight services, Logistics, Transportation, Warehousing, Supply chain","HTML, CSS, JavaScript, PHP, WordPress"
https://myprimarycleaning.com/,Cleaning Services,"My Primary Cleaning is a professional cleaning company offering a range of residential and commercial cleaning services. They emphasize their commitment to eco-friendly practices and reliable, high-quality cleaning.","Cleaning services, house cleaning, commercial cleaning, eco-friendly cleaning, residential cleaning","WordPress, Elementor"
https://ngentech.net/,Technology & IT,"NGEN Tech specializes in providing comprehensive IT solutions and managed services to businesses. They focus on optimizing IT infrastructure, enhancing cybersecurity, and offering ongoing support to help companies leverage technology for growth.","IT solutions, managed services, cybersecurity, cloud computing, tech support","HTML, CSS, JavaScript, PHP (likely using a framework/CMS but difficult to determine the exact one without deeper analysis)"
https://offerock.com/,Digital Agency,"Offerock is a digital agency that helps businesses grow through various digital marketing strategies, including SEO, PPC, and content marketing. They focus on driving measurable results and optimizing online presence for their clients.","Digital Marketing, SEO, PPC, Content Marketing, Lead Generation","HTML, CSS, JavaScript (Likely uses a framework or library like React or Angular), Likely a CMS such as WordPress."
https://sequoiatherapy.com/,Health & Wellness: BodyandMindRebalance,"Sequoia Therapy provides personalized therapy and coaching services to help individuals achieve holistic well-being, improve their relationships, and navigate life transitions. They offer various modalities like individual therapy, couples therapy, and mindfulness coaching.","Therapy, Coaching, Mindfulness, Relationships, Well-being",**WordPress**
https://teachlearnlead.net/,Education & Learning,Teach Learn Lead is a website dedicated to providing resources and training for educators to enhance their leadership skills and improve their teaching practices. They offer a range of professional development programs and resources to support educators at all levels.,"Teacher Leadership, Professional Development, Education, Leadership Training, Educator Resources","WordPress, Elementor (Likely, based on visual inspection of the site's structure)"
https://teampuggi.com/,Health & Wellness,"Team PUGGi offers a personalized, gamified approach to fitness and healthy habits, focusing on community support and accountability to help individuals achieve their wellness goals. They use technology to integrate fitness and social connection.","Fitness, Gamification, Wellness, Community, Healthy Habits","HTML, CSS, JavaScript, WordPress (likely based on the presence of WordPress-specific files and structures when inspecting the site)"
https://tencowtees.com/,E-commerce,"Ten Cow Tees is an online store that sells a variety of graphic t-shirts for men, women, and children. They offer a range of designs, including humor, animals, and pop culture themes.","T-shirts, graphic tees, online apparel, clothing, novelty shirts","Shopify, CSS, JavaScript"
https://tritonsoundresidential.com/,Real Estate,"Triton Sound Residential provides property management services, specializing in managing single-family homes and small apartment buildings in the Puget Sound area. They focus on maximizing the value of properties for owners and ensuring a positive experience for tenants.","Property Management, Rental Management, Puget Sound Real Estate, Tenant Screening, Property Maintenance","HTML, CSS, JavaScript, WordPress"
https://urbanhealthgroupinc.org/,Medical Services,"Urban Health Group is a healthcare provider offering a wide range of medical services, including primary care, specialized treatments, and wellness programs. They focus on providing comprehensive and patient-centered care to improve the health and well-being of their community.","Medical Clinic, Primary Care, Healthcare, Wellness, Specialist Care","Likely WordPress (based on common theme structure and ease of use for informational websites), HTML, CSS, JavaScript"
https://viridia.ky/,Health & Wellness: MentalHealth,"Viridia.ky appears to be a website dedicated to providing mental health resources and support. It emphasizes community, connection, and offers information about mental health conditions and strategies for well-being.","mental health, mental wellness, community, support, resources","Appears to be built on **WordPress**. (Based on visual clues, site structure and common elements associated with WP sites)."
https://www.advancedxl.com/,Business Services,AdvancedXL offers business solutions and consulting services focused on helping companies improve their performance and achieve their goals. They provide tailored strategies and tools to optimize business processes and drive growth.,"Business Consultancy, Business Solutions, Business Advisor, Professional Development, Business Performance","HTML, CSS, JavaScript"
https://jegnite.com/,Digital Agency,"Jegnite is a digital agency focused on helping businesses grow through data-driven digital marketing strategies. They offer services such as SEO, PPC, web design, and social media management to improve online presence and drive conversions.","Digital Marketing, SEO, PPC, Web Design, Social Media Marketing",Appears to be built using **WordPress** (based on the presence of WordPress-related CSS and JavaScript files and overall structure).
https://www.trianglesmartdivorce.com/,Legal Services,"Triangle Smart Divorce is a law firm specializing in divorce and family law in the Raleigh, Durham, and Chapel Hill areas of North Carolina. The website provides information about their services, team, and resources to help individuals navigate the divorce process.","Divorce lawyer, family law, divorce mediation, child custody, alimony, Raleigh, Durham, Chapel Hill, North Carolina.",WordPress
https://dadrainfellas.com/,Construction & Home Services,"Da Drain Fellas specializes in drain cleaning and plumbing services. They offer hydro jetting, camera inspections, drain cleaning, and general plumbing repairs for both residential and commercial clients.","Drain Cleaning, Plumbing, Hydro Jetting, Camera Inspection, Sewer Cleaning",WordPress
https://lservicesthecompany.com/,Business Services,"L Services The Company offers business consultancy and IT consultant services, focusing on providing strategic guidance and technological solutions to help businesses thrive and achieve their goals. They emphasize a personalized approach to drive sustainable growth and improve overall business performance.","Business Consultancy, IT Consultant, Business Solutions, Strategy, Technology Solutions","HTML, CSS, JavaScript"
https://designoflex.com/,Business Services,"Designoflex provides business consultancy services focused on brand strategy, digital solutions, and growth acceleration. They help businesses analyze, visualize, and execute strategies to improve performance and reach their goals.","Business Consultancy, Brand Strategy, Digital Solutions, Growth Acceleration, Business Analysis","It's difficult to determine the exact tech stack without deeper analysis, but based on a basic inspection, it is likely built on **HTML, CSS, JavaScript, PHP** and potentially utilizing a **WordPress** platform or a similar CMS due to the dynamic content and blog section."
https://aspectstaging.com/,Construction & Home Services,Aspect Staging is a home staging company that helps real estate agents and homeowners prepare properties for sale by strategically furnishing and decorating them to appeal to potential buyers. They aim to maximize property value and expedite the selling process through professional staging services.,"Home Staging, Real Estate Staging, Property Staging, Interior Design, Home Selling",WordPress
https://simonbroslabs.com/,Digital Agency,"Simon Bros Labs is a digital marketing agency that focuses on helping businesses grow through comprehensive online marketing solutions. They specialize in services such as SEO, PPC, and content monetization to improve brand visibility and drive revenue growth.","Digital Marketing, SEO, PPC, Content Monetization, Online Marketing","HTML, CSS, JavaScript"
https://maloneyinjurylawfirm.com/,Legal Services,"The Maloney Injury Law Firm website aims to attract individuals who have been injured due to someone else's negligence and are seeking legal representation. The site promotes the firm's services, expertise, and commitment to helping clients obtain compensation for their injuries.","Injury Lawyer, Personal Injury, Car Accident, Truck Accident, Wrongful Death",WordPress
https://dallasmdassociates.com/,Medical Services,"Dallas Medical Associates is a medical practice offering comprehensive healthcare services, including primary care, specialized treatments for various conditions, and convenient online virtual care options. They emphasize a patient-centered approach and integrated, evidence-based medicine.","Medical care, Primary care, Internal medicine, Virtual care, Dallas TX","WordPress, Elementor"
https://crescent-trading.com/,Financial Services,"Crescent Trading provides financial solutions, specializing in commercial loans and equipment financing for businesses. They aim to facilitate growth and expansion for their clients by offering tailored financing options.","Commercial Loans, Equipment Financing, Business Financing, Loan Solutions, Financial Services","HTML, CSS, JavaScript, PHP (likely using a framework like Laravel or Symfony given the modern design and features)"
https://nypifirm.com/,Business Services,"NYPI Firm provides business funding and financial solutions, including business loans and strategies for achieving financial freedom. They appear to specialize in helping businesses secure funding for growth and operational needs.","Business Funding, Business Loans, Financial Freedom, Capital Solutions, Business Consultancy","HTML, CSS, JavaScript (Likely using a CMS like WordPress due to the structure and general appearance, but hard to confirm without further investigation)"
https://www.legendnt.com/,Digital Agency,"LegendNT is a digital agency that specializes in helping businesses grow their online presence through services like SEO, PPC advertising, and website design. They aim to provide tailored digital solutions that drive traffic, generate leads, and increase conversions.","Digital Marketing, SEO, PPC, Web Design, Lead Generation","Although it is difficult to definitively identify the tech stack without deeper analysis, the website appears to be built using **WordPress** (likely) along with standard web technologies like **HTML, CSS, and JavaScript**."
https://www.toons-ville.com/,E-commerce,"Toons-Ville is an online store that sells a variety of products, including apparel, jewelry (earrings, piercing), and books. It appears to be geared towards a general audience with a focus on diverse product offerings.","Apparel, Jewelry, Earrings, Piercing, Books, Online Store","HTML, CSS, JavaScript"
https://commercialplus.com/,Business Services,"Commercial Plus appears to be a business consultancy firm offering a range of services including business loans, funding, and financial advisory. They aim to help businesses succeed by providing expertise in areas like financial planning, growth strategies, and access to capital.","Business Consultancy, Business Loans, Business Funding, Financial Advisory, Business Growth","HTML, CSS, JavaScript"
https://koyathletic.com/,E-commerce,Koy Athletic is an online store specializing in athletic wear for both men and women. They offer a range of apparel designed for performance and comfort during workouts and other athletic activities.,"Athletic wear, Gym wear, Workout clothes, Activewear, Performance apparel",Likely **Shopify** (based on the design and functionality).
https://pharmadrug.ca/,Medical Supplements,"PharmaDrug Inc. is a specialty pharmaceutical company focused on the research, development, and commercialization of controlled-substances and natural medicines such as psychedelics, cannabinoid products, and specialized natural health products. They aim to improve health outcomes through innovative approaches to medicine.","PharmaDrug, pharmaceuticals, psychedelics, cannabinoids, natural health products","Based on observation, it appears the site is built using a Content Management System (CMS). It also seems to have Javascript framework, Bootstrap, and possibly PHP. It is hosted by Cloudflare. So, the tech stack is: **HTML, CSS, JavaScript, PHP, Bootstrap, CMS**"
https://elcpa.com/,Business Services,ELCPA is a CPA firm specializing in tax advisory services for dentists and other businesses. They offer financial and business solutions to help clients achieve financial freedom.,"CPA, Tax Advisory, Dentists, Business Solutions, Financial Freedom",WordPress
https://senoa.io/,Digital Agency,"Senoa.io is a digital agency focused on helping businesses grow through innovative and data-driven marketing strategies. They offer services such as performance marketing, SEO, social media management, and content creation to drive measurable results for their clients.","Digital Marketing, Performance Marketing, SEO, Social Media Management, Content Marketing","HTML, CSS, JavaScript (likely a modern JavaScript framework like React or Vue.js based on the site's responsiveness and dynamic elements), potentially a backend framework like Node.js or Python with Django/Flask, and likely uses tools like Google Analytics and Google Tag Manager."
https://www.muhammadprojects.com/lift-aviation/,Aviation,"This website promotes Lift Aviation, an aviation company that offers various services. The website highlights their expertise and dedication to the industry.","Lift Aviation, Aviation Services, Aircraft Maintenance, Aviation Company, Aviation Consulting","HTML, CSS, JavaScript (Potential WordPress)"
https://muhammadprojects.com/donation-nation/,Non-Profit & NGO,"Donation Nation by Muhammad Projects facilitates charitable giving to support various initiatives, focusing on community development and uplifting the less fortunate. The website provides a platform for individuals to contribute financially and participate in impactful projects.","Donations, Charity, Non-profit, Community Development, Muhammad Projects","HTML, CSS, JavaScript, WordPress (Likely based on visual assessment and common NGO website platforms)"
https://www.muhammadprojects.com/jill-baker/,Creative & Media,"This website showcases the portfolio of Jill Baker, a freelance photographer specializing in food, product, lifestyle, and travel photography. The site allows potential clients to view her work and contact her for assignments.","Photography, Food Photography, Product Photography, Lifestyle Photography, Travel Photography, Portfolio","HTML, CSS, JavaScript"
https://gentrycleanersinc.com/,Cleaning Services,"Gentry Cleaners Inc. provides dry cleaning and laundry services in the greater Chicago area. They offer a range of services including wash and fold, dry cleaning, alterations, and more, with a focus on quality and convenience.","Dry Cleaning, Laundry Service, Wash and Fold, Alterations, Chicago Cleaners","WordPress, HTML, CSS, JavaScript"
https://muhammadprojects.com/pita-street-food/,Business Services,"This website promotes Pita Street Food, a restaurant offering Mediterranean and Middle Eastern cuisine. It allows customers to explore the menu, find location information, and potentially order online or make reservations.","Pita Street Food, Mediterranean food, Middle Eastern cuisine, restaurant, catering",WordPress
https://www.muhammadprojects.com/startosphere-v2/,Digital Agency,StarToSphere V2 is a digital marketing agency that specializes in helping businesses grow and succeed online. They offer services like digital marketing and content monetization with the aim of providing the best customer experience.,"Digital Marketing, SEO, Content Monetization, Online Marketing, Business Growth","HTML, CSS, JavaScript, Bootstrap (Likely based on the visual design and common elements of Bootstrap)"
https://muhammadprojects.com/steak-for-breakfast/,Health & Wellness,"This website promotes the idea of eating steak for breakfast as a means to improve health, lose weight, and boost energy. It features articles, recipes, and testimonials related to this dietary approach.","Steak for breakfast, carnivore diet, high-protein diet, weight loss, healthy eating",WordPress
https://muhammadprojects.com/wartime/,Non-Profit & NGO,"The website aims to educate and raise awareness about the suffering of children affected by wars in Muslim countries, particularly focusing on providing aid and support. It shares personal stories and testimonials to highlight the human impact of conflict and encourage charitable donations.","War, Children, Muslim Countries, Charity, Aid, Humanitarian, Donate","HTML, CSS, JavaScript"
https://muhammadprojects.com/sea-glass/,E-commerce,"MuhammadProjects.com/sea-glass is an e-commerce website selling handcrafted sea glass jewelry. It showcases the beauty of sea glass and offers unique, ocean-inspired products for purchase.","Sea Glass Jewelry, Beach Glass, Handmade Jewelry, Coastal Jewelry, Ocean Jewelry","HTML, CSS, JavaScript"
https://muhammadprojects.com/ensemble/,Digital Agency,"The website promotes Ensemble, a platform by Muhammad Projects that likely offers services related to digital marketing, SEO, and online growth strategies. It showcases client success stories and invites visitors to schedule a consultation to explore partnership opportunities.","Digital Marketing, SEO, Growth Strategy, Online Marketing, Digital Agency","HTML, CSS, JavaScript (Likely based on a custom-built website rather than a CMS like WordPress, although specific details require further inspection)"
https://www.muhammadprojects.com/law-order/,Legal Services,"The website advocates for the implementation and enforcement of Sharia law, arguing its suitability for modern governance and addressing common misconceptions about its principles and applications. It provides articles and resources related to law, order, and Islamic legal principles.","Sharia law, Islamic law, Law and order, Islamic governance, Legal principles, Islamic jurisprudence","HTML, CSS, JavaScript"
https://www.muhammadprojects.com/maineri-law-firm/,Legal Services,"The Maineri Law Firm website provides information about their legal services, focusing on areas like divorce and family law, personal injury, criminal defense, and business law. It aims to attract potential clients by highlighting their expertise and offering a way to contact them for consultations.","Law Firm, Divorce Lawyer, Injury Lawyer, Criminal Defense, Business Law, Legal Consultation","HTML, CSS, JavaScript"
https://muhammadprojects.com/altumsolutions,Business Services,"Altum Solutions provides business advisory services, focusing on financial planning and guidance. They offer solutions for businesses seeking funding, growth strategies, and overall financial well-being.","Business Consultancy, Business Advisor, Business Solutions, Business Fundings, Financial Freedom",WordPress
https://www.muhammadprojects.com/industrial-environmental/,Manufacturing & Industrial,"The website showcases Muhammad Projects' expertise in industrial environmental solutions, including environmental impact assessments, compliance, waste management, and sustainable practices for various industrial sectors. They aim to help businesses minimize their environmental footprint and adhere to environmental regulations.","Environmental Impact Assessment, Industrial Waste Management, Environmental Compliance, Sustainability, Environmental Consulting","HTML, CSS, JavaScript"
https://www.muhammadprojects.com/democratic-school/,Education & Learning,"The Muhammad Projects Democratic School website advocates for a student-centered and community-driven educational approach. It details the principles and practices of democratic schooling, emphasizing student freedom, responsibility, and active participation in decision-making.","Democratic School, Alternative Education, Student-Centered Learning, Free School, Sudbury School","WordPress, HTML, CSS, JavaScript"
https://muhammadprojects.com/muscle-magic/#,FitnessTraining,"Muscle Magic, by Muhammad Projects, offers personalized fitness training programs designed to help clients achieve their muscle-building and fitness goals. The website features testimonials, program details, and a contact form for inquiries.","Muscle building, fitness training, personal training, workout programs, bodybuilding","HTML, CSS, JavaScript (Likely built on a static site generator or custom coded)"
https://www.muhammadprojects.com/startosphere-v3/,Business Services,"Startosphere V3 is a website designed to help entrepreneurs and businesses get started, offering resources and support to launch their ventures. It aims to provide a platform for guidance and potentially connect businesses with necessary services or information.","entrepreneurship, business startup, business resources, business solutions, business advice","HTML, CSS, JavaScript"
https://muhammadprojects.com/rip-city/,Digital Agency,"This website appears to be a portfolio or landing page showcasing digital marketing services, specifically focusing on SEO and content monetization. It highlights experience with generating substantial content views and revenue.","Digital Marketing, SEO, Content Monetization, YouTube Monetization, Digital Agency","HTML, CSS, JavaScript (likely using a framework or library), WordPress"
https://muhammadprojects.com/enchanted/,E-commerce,The website is an online store that sells wall art and home decor featuring abstract designs and nature themes. It aims to offer a unique selection of art pieces to enhance home aesthetics.,"Wall Art, Home Decor, Abstract Art, Nature Art, Prints","likely built on **Shopify** (Based on site structure, design, and functionality)"
https://insitechstaging.com/demo/pavilion/,Real Estate,"This website showcases a luxury real estate development called ""Pavilion."" It highlights property features, offers floorplans, and provides a way to contact the sales team for inquiries or to schedule a viewing.","Real Estate, Luxury Homes, Property Development, Apartments, Residences","HTML, CSS, JavaScript (Likely built on a custom framework or content management system - the exact framework is difficult to determine without deeper inspection of the code)"
https://insitechstaging.com/demo/pro-auto-towing/,Transportation & Logistics,"This website promotes a towing and roadside assistance service. It offers emergency towing, car recovery, and other auto-related services.","Auto Towing, Roadside Assistance, Car Recovery, Emergency Towing, Tow Truck","WordPress, Elementor (likely used based on observed design and structure)"
https://clients.muhammadprojects.com/insitechv3/,Technology & IT,"InsiTech appears to be an IT solutions company offering services like data organization, AI chatbot development, cloud computing, and other tech-related solutions. The website serves as a platform to showcase their expertise and attract potential clients seeking technology-driven solutions.","IT Solutions, Data Organization, AI Chatbot, Cloud Computing, Tech Services","HTML, CSS, JavaScript, Possibly PHP (likely WordPress due to the structure and common elements)"
https://clients.muhammadprojects.com/insitechv2/,Technology & IT,"InsiTech is a technology company specializing in providing data organization and IT solutions for businesses. The website showcases their services, client testimonials, and contact information to attract potential customers.","Data Organization, IT Solutions, Tech Services, Cloud Computing, Business IT Support","HTML, CSS, JavaScript, PHP, WordPress"
https://clients.muhammadprojects.com/theodore/,Digital Agency,"The website promotes Theodore, a digital marketing agency. It showcases services like SEO, PPC, and other digital marketing strategies to help businesses grow online.","Digital Marketing, SEO, PPC, Web Design, Social Media Marketing","HTML, CSS, JavaScript"
