Website Links,Category,Description,Keywords,Techstacks
https://clients.muhammadprojects.com/detore/,Construction & Home Services,"Detore is a construction and home services company providing solutions for residential and commercial projects, including remodeling, renovations, and new construction. They offer a range of services from initial design to project completion, focusing on quality craftsmanship and customer satisfaction.","Construction, Remodeling, Renovation, Home Services, Commercial Construction","**HTML, CSS, JavaScript, WordPress** (Based on visual inspection of the website and common website building practices)"
https://clients.muhammadprojects.com/toons-ville/,Creative & Media,"Toons Ville showcases a portfolio of 2D and 3D animation projects and visual effects, displaying the creative and technical skills of the team. The website aims to attract potential clients seeking animation and visual effects services.","2D Animation, 3D Animation, Visual Effects, VFX, Motion Graphics, Animation Portfolio","HTML, CSS, JavaScript, WordPress"
https://clients.muhammadprojects.com/northern-arizona/,Real Estate,"The website appears to be a real estate portal focused on properties in Northern Arizona. It allows users to search for listings, view property details, and potentially connect with real estate professionals in the area.","Northern Arizona real estate, property listings, homes for sale, real estate agents, Arizona real estate","HTML, CSS, JavaScript, WordPress"
https://beauty-salon-react.surge.sh/,Fashion & Beauty,"The website showcases a beauty salon offering a range of services including haircuts, styling, coloring, and other beauty treatments. It features a clean and modern design with information about the salon's services, team, and contact details.","Beauty salon, Haircut, Hairstyling, Hair coloring, Beauty treatments","React, JavaScript, CSS, HTML"
https://www.vitalityskin.com.au/,Salon&SPA,"Vitality Skin is a skin clinic based in Australia that offers a range of advanced skincare treatments and products, including facials, peels, and laser therapies. The website showcases their services, team, and provides information about skincare and booking appointments.","Skin clinic, skincare, facials, laser treatments, skin rejuvenation, peels, anti-aging","**WordPress**, **Elementor** (likely, based on the website's structure and layout)"
https://insitechstaging.com/demo/stylist-factory/wp/,Fashion & Beauty,"The website appears to be a demo for a salon or beauty service provider, specifically focused on hair stylists. It showcases stylist profiles, booking options, and various hair styling services.","Hair stylist, salon, hair styling, beauty, appointment booking",WordPress
https://portfolio.muhammadprojects.com/kultureinstitue/,Education & Learning,"Kulture Institute is a cosmetology school offering courses and training in various beauty and personal care services, as well as business skills for those aspiring to be entrepreneurs in the beauty industry. The website highlights their programs, instructors, and success stories, encouraging prospective students to enroll and learn more.","Cosmetology school, beauty courses, salon training, esthetics, cosmetology education, cosmetology business","HTML, CSS, JavaScript, WordPress (Likely using WordPress as the base platform, with possible custom themes and plugins)"
https://muhammadprojects.com/rhythm-experts/,Education & Learning,"Rhythm Experts is a platform dedicated to teaching rhythm through structured lessons, challenges, and personalized feedback. The website aims to make rhythm learning accessible and engaging through an interactive online experience.","Rhythm, Music Education, Online Learning, Music Theory, Rhythm Training","HTML, CSS, JavaScript, (Likely uses a JavaScript framework like React or Angular for interactivity), Possibly a backend like Node.js or Python with a database for user accounts and progress tracking."
https://desertknightpainting.com/,Construction & Home Services,"Desert Knight Painting is a painting company that offers interior and exterior painting services for residential and commercial properties. They emphasize quality workmanship, customer satisfaction, and a clean work environment.","Painting, Interior Painting, Exterior Painting, Residential Painting, Commercial Painting","WordPress, Elementor"
https://portfolio.muhammadprojects.com/duro-athletics/,Health & Wellness,"Duro Athletics is a fitness training website offering workout programs, personalized coaching, and nutritional guidance to help individuals achieve their fitness goals. It emphasizes building a sustainable and healthy lifestyle through tailored fitness plans.","Fitness training, workout programs, personalized coaching, nutrition, healthy lifestyle","HTML, CSS, JavaScript (likely with a framework or library), potentially a backend platform for content management."
https://portfolio.muhammadprojects.com/thefrgn/,Digital Agency,"The website showcases a portfolio of digital marketing and creative projects, likely aimed at attracting potential clients. It emphasizes digital marketing services, design, and video production.","Digital Marketing, Web Design, Video Production, Branding, Creative Agency","HTML, CSS, JavaScript (likely with frameworks/libraries), likely using a content management system (CMS) such as WordPress or a static site generator."
https://chiheirluums.com/,Fashion & Beauty,"Chiheirluums is an online jewelry store specializing in handcrafted earrings and necklaces. The site showcases unique designs that blend geometric shapes, gemstones, and wirework, offering a range of styles from minimalist to statement pieces.","Jewelry, Earrings, Necklace, Handcrafted Jewelry, Geometric Jewelry","HTML, CSS, JavaScript, React"
https://www.muhammadprojects.com/jodi-picoult/,E-commerce,"This website is dedicated to Jodi Picoult and her literary works. It provides summaries of her books, potentially offering a curated collection of resources or projects related to her name, presumably to engage with her fanbase and promote her writing.","Jodi Picoult, books, author, novels, book summaries","HTML, CSS, JavaScript"
https://insitechstaging.com/demo/brochure-design/,Digital Agency,"This website showcases brochure design services, presenting a variety of brochure templates and design options for different business needs. It aims to attract potential clients looking for professional brochure design services.","Brochure design, graphic design, marketing materials, corporate brochure, design templates","HTML, CSS, JavaScript (Likely uses a framework or library, but difficult to determine specific one without further inspection of the source code), WordPress (Based on the URL structure `insitechstaging.com`, this is highly likely)"
https://insitechstaging.com/demo/getting-sheared/wp-admin/,E-commerce,"This website appears to be an online store selling barber products. It includes features typical of an e-commerce platform, such as a product catalog, shopping cart functionality, and account management.","Barber products, shaving, grooming, haircare, men's grooming","WordPress, WooCommerce"
https://insitechstaging.com/demo/luckybackyard/customwp/,Construction & Home Services,"This website appears to be a landing page for a construction or home services company specializing in outdoor living spaces and backyard renovations, possibly including pools, landscaping, and other outdoor features. It seems to offer design and construction services to transform backyards into desirable living spaces.","Backyard design, outdoor living, construction, landscaping, home renovation",WordPress
https://insitechstaging.com/demo/badboystrain/,FitnessTraining,"This website promotes a fitness program called ""Bad Boys Train"" led by trainers with backgrounds in boxing. It offers training, nutrition plans, and a community for individuals seeking to improve their fitness.","Fitness Training, Boxing, Nutrition, Workout, Exercise","HTML, CSS, JavaScript"
https://insitechstaging.com/demo/barefoot-xpress,E-commerce,"Barefoot Xpress is an online store specializing in barefoot and minimalist footwear for various activities, including running, training, and everyday wear. They offer a range of shoes designed to promote natural foot movement and a connection to the ground.","barefoot shoes, minimalist footwear, running shoes, training shoes, zero-drop shoes","WordPress, WooCommerce, PHP, JavaScript, CSS"
https://insitechstaging.com/demo/boiling-wit/,Digital Agency,"The website appears to be a portfolio for a digital agency called Boiling Wit. It showcases their services, past projects, and provides contact information for potential clients.","Digital Marketing, Web Design, SEO, Content Marketing, Branding","**WordPress**, Elementor (Likely), JavaScript (Likely), PHP"
https://insitechstaging.com/demo/calgary-markets/wp-admin/,Real Estate,"The website seems to be a directory or listing platform specifically for Calgary real estate, possibly focusing on commercial or investment properties as suggested by the ""markets"" in the domain. It likely aims to connect buyers and sellers or renters of real estate in Calgary.","Calgary real estate, property listings, commercial real estate, investment properties, real estate market",WordPress
https://insitechstaging.com/demo/children-band/,E-commerce,"This website appears to be an online store selling children's musical instruments and related accessories. It features product listings, descriptions, pricing, and potentially a shopping cart for customers to purchase items.","Children's instruments, musical instruments, kids music, music toys, band instruments","While not definitively confirmed without deeper inspection, it is highly probable that the website is built using **WordPress** and the **WooCommerce** plugin (given the ""E-commerce"" nature, appearance and likely functionality). Other components include **HTML, CSS, JavaScript.**"
https://insitechstaging.com/demo/cupsmx/,E-commerce,"This website appears to be an online store selling various products. It has a shopping cart, product listings, and potentially payment processing capabilities.","Ecommerce, Online store, Shopping, Products, Buy online","WooCommerce, WordPress, PHP, Javascript"
https://insitechstaging.com/demo/dakam/,Construction & Home Services,"This website appears to be for a construction and home services company offering a variety of services including construction, roofing, plumbing, and electrical solutions. It also seems to offer home automation and office automation services.","Construction, Roofing, Plumbing, Electrical Solutions, Home Automation, Office Automation",WordPress
https://insitechstaging.com/demo/DL-Tax-solution/,Business Services,"This website provides tax advisory and preparation services, specifically tailored for dentists. It offers solutions to navigate the complexities of dental-related tax matters.","Tax advisory, tax preparation, dentists, dental tax, tax solutions","HTML, CSS, JavaScript (Likely built with a CMS, possibly WordPress, but difficult to confirm without further investigation)"
https://insitechstaging.com/demo/dropshipping/wp/,E-commerce,"This website appears to be a demo dropshipping store, showcasing a variety of products ranging from apparel to home goods. The site aims to demonstrate the functionality and design capabilities of a dropshipping platform, likely for potential customers.","Dropshipping, E-commerce, Online Store, WooCommerce, Demo Store","WordPress, WooCommerce, HTML, CSS, JavaScript"
https://insitechstaging.com/demo/evergreen,Digital Agency,"Evergreen is a digital agency that specializes in helping businesses grow through various online marketing strategies. They offer services like SEO, PPC, and content monetization to enhance their clients' digital presence and drive business results.","Digital Marketing, SEO, PPC, Content Monetization, Digital Agency",**WordPress** (Based on the footer mentioning WordPress theme)
https://insitechstaging.com/demo/soldier-mountain-highland/,Travel & Tourism,"This website promotes Soldier Mountain Highland, a resort offering vacation rentals and recreational activities. It provides information about the resort, including lodging options, activities, and booking details.","Vacation Rentals, Resort, Soldier Mountain, Highland, Recreation",WordPress
https://insitechstaging.com/demo/transportation-trend-setter/,Transportation & Logistics,"The website appears to be a promotional site for a transportation and logistics company emphasizing sustainability and technology-driven solutions. It highlights services like fleet management, green initiatives, and a focus on being a trendsetter in the industry.","Transportation, Logistics, Sustainable Transportation, Fleet Management, Green Logistics","HTML, CSS, JavaScript (Likely a custom-built website or utilizing a framework rather than a CMS like WordPress)"
https://insitechstaging.com/demo/kadobu,E-commerce,"Kadobu appears to be an e-commerce website specializing in selling cakes and desserts online. The site allows customers to browse a variety of sweet treats, customize orders, and likely purchase them for delivery or pickup.","Cakes, Desserts, Online Food Store, Order Online, Catering",The website appears to be using **WooCommerce** based on the category selected.
https://insitechstaging.com/demo/iron-gate,Real Estate,"The Iron Gate website showcases a luxury real estate property, highlighting its various features, amenities, and surrounding community. It seems to be geared towards attracting potential buyers or renters interested in high-end living.","Real Estate, Luxury Property, Home for Sale, Property Listing, Iron Gate","HTML, CSS, JavaScript (likely with a framework or library, but hard to determine specifics without further investigation), PHP (likely WordPress based on structure), WordPress (likely)"
https://insitechstaging.com/demo/martialartsinthepark/,Sports & Recreation,"Martial Arts in the Park offers outdoor martial arts classes in local parks. The website provides information about their programs, schedule, instructors, and registration details.","Martial Arts, Outdoor Fitness, Park Classes, Boxing, Self-Defense",Appears to be built with **WordPress** (based on the general structure and plugins often used). A deeper code analysis would be needed for confirmation.
https://insitechstaging.com/demo/monsoon-security/,Technology & IT,"Monsoon Security offers a suite of cybersecurity solutions and services to protect businesses from online threats. The website highlights their expertise in areas like threat detection, incident response, and vulnerability management, aiming to provide comprehensive security for their clients.","Cybersecurity, threat detection, incident response, vulnerability management, security solutions","HTML, CSS, JavaScript, PHP (likely a WordPress based website)"
https://insitechstaging.com/demo/stylist-factory/wp/wp-admin/,Fashion & Beauty / Salon&SPA,"This website appears to be a demo or staging site for a salon or beauty business built on WordPress. It likely showcases features for managing stylists, appointments, services, and potentially e-commerce for salon products.","Salon, Beauty, Stylist, Appointments, WordPress","WordPress, PHP, MySQL, HTML, CSS, JavaScript"
https://insitechstaging.com/demo/lazzat,Food & Hospitality,"Lazzat is a restaurant website showcasing its menu, ambiance, and services. It offers online booking and likely in-house catering options for customers.","Restaurant, Indian Cuisine, Food, Dining, Online Booking, Catering","HTML, CSS, JavaScript, WordPress (likely, based on the general structure and common elements), PHP (likely for WordPress functionality)"
https://insitechstaging.com/demo/philanthrocapitalistreview,Non-Profit & NGO,"The Philanthrocapitalist Review website appears to be a platform providing news, analysis, and commentary on the intersection of philanthropy and capitalism. It explores how business principles and market-based approaches are being applied to charitable endeavors and social impact initiatives.","Philanthropy, Capitalism, Social Impact, Impact Investing, Charitable Giving",WordPress
https://insitechstaging.com/demo/vaultofbeauty,Fashion & Beauty,"Vault of Beauty appears to be an e-commerce website focused on selling beauty products and potentially offering salon/spa services. The site showcases various skincare, makeup, and cosmetic items.","Beauty products, skincare, makeup, cosmetics, salon, spa","HTML, CSS, JavaScript, WooCommerce"
https://insitechstaging.com/demo/voxa-marketing/wp/,Digital Agency,"This website promotes a digital marketing agency showcasing its services, expertise, and client success stories. The goal is to attract new clients and demonstrate their capabilities in the digital marketing landscape.","Digital Marketing, SEO, PPC, Social Media Marketing, Web Design",WordPress
https://insitechstaging.com/demo/jeff-macgrandles/,Real Estate,"This website showcases Jeff MacGrandles, a real estate professional. It provides information about him, his expertise, and his contact details, aiming to attract potential clients looking to buy or sell properties.","Real Estate, Property Management, Home Buying, Home Selling, Real Estate Agent","The website appears to be built using **HTML, CSS, JavaScript** and likely uses a framework or library for structure and styling although is not immediately apparent from the source code."
https://insitechstaging.com/demo/jonathan/,Health & Wellness,"This website appears to be a portfolio for a personal trainer named Jonathan. The site highlights his services, testimonials, and provides a contact form for potential clients.","Personal Training, Fitness, Exercise, Health, Wellness","HTML, CSS, JavaScript, (Likely uses a website builder like Wordpress or similar)"
https://insitechstaging.com/demo/weight-pullers/,Pet Care,"This website provides services related to training and caring for dogs, specifically focusing on weight pulling and other dog-related activities. It appears to offer training programs, educational resources, and potentially a community for dog owners interested in these specialized activities.","Dog Training, Weight Pulling, Dog Care, Dog Sports, Canine Fitness","While I can't definitively determine the tech stack without further investigation, the site likely uses **HTML, CSS, JavaScript**. Given the layout and functionality, it may also be built on a **WordPress** platform with a custom theme or page builder."
https://insitechstaging.com/demo/eric-scott/,Real Estate,"The website appears to be a landing page for a real estate professional named Eric Scott. It showcases properties, offers contact information, and provides resources for potential buyers and sellers.","Real Estate, Property, Eric Scott, Buying, Selling, Homes","HTML, CSS, JavaScript"
https://insitechstaging.com/demo/alberto-herrera/,Health & Wellness,"The website appears to be a portfolio and lead generation site for Alberto Herrera, a personal trainer. It highlights his experience, specializations, and offers contact information for potential clients.","Personal Trainer, Fitness, Training, Wellness, Coaching, Exercise","**HTML, CSS, JavaScript** (Likely built using a static site generator or custom development as there's no evidence of a CMS like WordPress)"
https://insitechstaging.com/demo/kerry-kinard/,Health & Wellness,"The website showcases Kerry Kinard, a personal trainer offering fitness programs, nutritional guidance, and workout routines. It aims to attract clients seeking personalized fitness solutions to achieve their health and wellness goals.","Personal Training, Fitness, Nutrition, Workout, Health, Wellness","**HTML, CSS, JavaScript** (Likely a custom-built site or a simple website builder, not a complex platform like WordPress or Shopify based on the simplicity and content)"
https://insitechstaging.com/demo/organx/,Health & Wellness,"The OrganX website promotes a holistic approach to wellness through personalized programs focusing on nutrition, fitness, and mental well-being. It emphasizes customized plans, expert guidance, and tools for achieving optimal health and balance.","health, wellness, nutrition, fitness, personalized programs, mental health","HTML, CSS, JavaScript, WordPress (Likely based on the structure and common features of WordPress sites)"
https://insitechstaging.com/demo/titans/,Health & Wellness,"The website appears to be a promotional site for a fitness training program called ""Titans."" It highlights the benefits of their fitness approach and encourages visitors to explore their offerings, potentially through contacting them.","Fitness, Training, Titans, Strength, Workout","HTML, CSS, JavaScript"
https://insitechstaging.com/demo/steve-grinding/,Health & Wellness,"The website promotes Steve Grinding, a fitness trainer. It showcases his services, training philosophy, and client testimonials, aiming to attract new clients.","Fitness training, personal trainer, strength training, weight loss, exercise","**HTML, CSS, JavaScript, WordPress** (Based on observation of the website structure and common elements used on WordPress sites.)"
https://insitechstaging.com/demo/tnt-services/,Construction & Home Services,"This website showcases TNT Services, a company providing various construction and home services. The site highlights their expertise in different areas like roofing, home automation, and electrical solutions, aiming to attract potential clients seeking reliable home improvement and construction services.","Construction, Home Services, Roofing, Electrical Solutions, Home Automation","Likely **WordPress** (due to the staging URL structure and common use for service-based businesses). HTML, CSS, JavaScript are almost certainly used as well."
https://insitechstaging.com/demo/rgc-groove/,Digital Agency,"The website promotes a digital agency named RGC Groove, highlighting their expertise in helping businesses achieve their goals. It showcases their capabilities in driving growth, building brands, and optimizing customer acquisition through tailored strategies.","Digital Marketing, SEO, Web Design, Brand Strategy, Customer Acquisition",WordPress
https://insitechstaging.com/demo/four-sight/,Business Services,"The FourSight website provides tools and resources to help individuals and teams improve their innovation skills and problem-solving abilities. It offers assessments, training, and insights based on the FourSight Thinking Profile, a framework designed to understand and enhance creative thinking styles.","Innovation, Creativity, Problem Solving, Thinking Styles, FourSight","HTML, CSS, JavaScript, WordPress (Likely, based on the structure and common elements)"
https://insitechstaging.com/demo/rthompson/,Real Estate,"This website appears to be for a real estate agent or company, showcasing property listings and providing information for buyers and sellers. It highlights featured properties, market insights, and client testimonials to attract potential clients.","Real Estate, Property Listings, Home Buying, Home Selling, Property Management",**WordPress** (based on visual cues and common WordPress themes)
https://insitechstaging.com/demo/calender/,Business Services,"The website appears to be a scheduling application or demo that allows users to view, create, and manage appointments on a calendar. It offers features for setting availability, booking appointments, and potentially integrating with other business tools.","scheduling, calendar, appointment booking, online scheduling, business calendar","HTML, CSS, JavaScript"
https://insitechstaging.com/demo/noir-moolah/,Financial Services,"Noir Moolah is a website that provides financial literacy resources and promotes financial freedom, focusing on strategies for building wealth and managing personal finances. It appears to offer tools, advice, and potentially courses or consultations to help users improve their financial well-being.","Financial Literacy, Financial Freedom, Investing, Wealth Building, Personal Finance","WordPress, Elementor, CSS, JavaScript"
https://insitechstaging.com/demo/triple-star/,Real Estate,"This website is for a real estate company (Triple Star Realty) focused on buying, selling, and managing properties. It showcases property listings, provides agent information, and offers resources for clients looking to buy or sell real estate.","Real Estate, Property Management, Buy and Sell, Property Listing, Home Buying","HTML, CSS, JavaScript, WordPress"
https://insitechstaging.com/demo/ferno/,Medical Services,"The Ferno website appears to be for a medical group or clinic offering a range of services. It prominently features information about their services, focus on diabetes care, and booking appointments.","Diabetes Clinic, Medical Clinic, Healthcare, Virtual Consultation, Medical Services","HTML, CSS, JavaScript, WordPress (Likely, based on the general structure and design)"
https://insitechstaging.com/demo/zachary-farrow/,Real Estate,"The website showcases Zachary Farrow, a real estate professional or company, highlighting properties and services related to buying, selling, and investing in real estate. It appears to be designed to attract clients looking for real estate opportunities.","Real Estate, Property Management, Buy and Sell, Investments, Property Listing","HTML, CSS, JavaScript, WordPress"
https://insitechstaging.com/demo/terra-nova/,Real Estate,"The website appears to be a platform for managing and showcasing real estate properties. It likely allows users to browse listings, view property details, and potentially contact agents or property managers.","PropertyManagement, PropertyListing, HomeBuyingandSelling, RealEstateDevelopment, PricingCalculator","HTML, CSS, JavaScript"
